{
  "schema_version": 1,
  "artifact_kind": "hajimi-timed-lyrics",
  "timebase": "seconds",
  "audio": {
    "path": "assets/bgm.wav",
    "sha256": "021b37371e3eaff7acc3a96abdef256583405e6580cf4e20307003e8e56ef3c9",
    "duration_seconds": 54.7,
    "sample_rate": 44100,
    "channels": 2,
    "frame_count": 2412270
  },
  "source_window": {
    "start_seconds": 30.3,
    "end_seconds": 85.0
  },
  "display": {
    "title": "百年孤寂",
    "title_en": "Century of Solitude",
    "artist_label": "王菲 / Faye Wong",
    "version": "HAJIMI NOTE / EVENT V1",
    "credit": "HAJIMI REMIX",
    "status": "INTERNAL AUTO-DRAFT PREVIEW / HUMAN LISTENING PENDING"
  },
  "sections": [
    {
      "id": "01-open",
      "role": "open",
      "label": "OPEN",
      "start_seconds": 0.0,
      "end_seconds": 18.04,
      "phrase_ids": [
        1,
        2
      ],
      "descriptor": "Dynamic V1 section mapped from phrase ids 1-2"
    },
    {
      "id": "02-build",
      "role": "build",
      "label": "BUILD",
      "start_seconds": 18.04,
      "end_seconds": 23.67,
      "phrase_ids": [
        3
      ],
      "descriptor": "Dynamic V1 section mapped from phrase ids 3-3"
    },
    {
      "id": "03-climax",
      "role": "climax",
      "label": "CLIMAX",
      "start_seconds": 23.67,
      "end_seconds": 24.955,
      "phrase_ids": [
        4
      ],
      "descriptor": "Dynamic V1 section mapped from phrase ids 4-4"
    },
    {
      "id": "04-outro",
      "role": "outro",
      "label": "OUTRO",
      "start_seconds": 24.955,
      "end_seconds": 54.7,
      "phrase_ids": [
        5,
        6
      ],
      "descriptor": "Dynamic V1 section mapped from phrase ids 5-6"
    }
  ],
  "phrases": [
    {
      "id": 1,
      "group_ids": [
        1,
        2,
        3,
        4,
        5,
        6,
        7,
        8,
        9,
        10,
        11
      ],
      "start_seconds": 0.0,
      "end_seconds": 11.07,
      "text": "哈基米南北绿豆哈基米南"
    },
    {
      "id": 2,
      "group_ids": [
        12,
        13,
        14,
        15,
        16,
        17,
        18,
        19,
        20
      ],
      "start_seconds": 11.07,
      "end_seconds": 18.04,
      "text": "哈基米南北绿豆哈基"
    },
    {
      "id": 3,
      "group_ids": [
        21,
        22,
        23,
        24,
        25,
        26,
        27,
        28,
        29,
        30,
        31,
        32,
        33
      ],
      "start_seconds": 18.04,
      "end_seconds": 23.67,
      "text": "哈基米南北绿豆哈基米南北绿"
    },
    {
      "id": 4,
      "group_ids": [
        34
      ],
      "start_seconds": 23.67,
      "end_seconds": 24.955,
      "text": "哈"
    },
    {
      "id": 5,
      "group_ids": [
        35,
        36,
        37,
        38,
        39,
        40
      ],
      "start_seconds": 24.955,
      "end_seconds": 28.92,
      "text": "哈基米南北绿"
    },
    {
      "id": 6,
      "group_ids": [
        41,
        42,
        43,
        44,
        45,
        46,
        47,
        48,
        49,
        50,
        51,
        52,
        53,
        54,
        55,
        56,
        57,
        58,
        59,
        60,
        61,
        62,
        63,
        64,
        65,
        66,
        67,
        68,
        69,
        70,
        71,
        72,
        73,
        74,
        75,
        76,
        77,
        78,
        79,
        80,
        81,
        82,
        83,
        84,
        85,
        86,
        87,
        88,
        89,
        90,
        91,
        92,
        93,
        94,
        95,
        96,
        97
      ],
      "start_seconds": 28.92,
      "end_seconds": 54.7,
      "text": "哈基米南北绿豆哈基米南北绿豆哈基米南北绿豆哈基米南北绿豆哈基米南北绿豆哈基米南北绿豆哈基米南北绿豆哈基米南北绿豆哈"
    }
  ],
  "lines": [
    {
      "id": "line-01",
      "phrase_id": 1,
      "text": "哈基米南北绿豆",
      "group_ids": [
        1,
        2,
        3,
        4,
        5,
        6,
        7
      ],
      "start_seconds": 5.295,
      "end_seconds": 8.11
    },
    {
      "id": "line-02",
      "phrase_id": 1,
      "text": "哈基米南",
      "group_ids": [
        8,
        9,
        10,
        11
      ],
      "start_seconds": 8.11,
      "end_seconds": 11.07
    },
    {
      "id": "line-03",
      "phrase_id": 2,
      "text": "哈基米南北绿豆",
      "group_ids": [
        12,
        13,
        14,
        15,
        16,
        17,
        18
      ],
      "start_seconds": 11.07,
      "end_seconds": 16.135
    },
    {
      "id": "line-04",
      "phrase_id": 2,
      "text": "哈基",
      "group_ids": [
        19,
        20
      ],
      "start_seconds": 16.135,
      "end_seconds": 18.04
    },
    {
      "id": "line-05",
      "phrase_id": 3,
      "text": "哈基米南北绿豆",
      "group_ids": [
        21,
        22,
        23,
        24,
        25,
        26,
        27
      ],
      "start_seconds": 18.04,
      "end_seconds": 20.085
    },
    {
      "id": "line-06",
      "phrase_id": 3,
      "text": "哈基米南北绿",
      "group_ids": [
        28,
        29,
        30,
        31,
        32,
        33
      ],
      "start_seconds": 20.085,
      "end_seconds": 23.67
    },
    {
      "id": "line-07",
      "phrase_id": 4,
      "text": "哈",
      "group_ids": [
        34
      ],
      "start_seconds": 23.67,
      "end_seconds": 24.955
    },
    {
      "id": "line-08",
      "phrase_id": 5,
      "text": "哈基米南北绿",
      "group_ids": [
        35,
        36,
        37,
        38,
        39,
        40
      ],
      "start_seconds": 24.955,
      "end_seconds": 28.92
    },
    {
      "id": "line-09",
      "phrase_id": 6,
      "text": "哈基米南北绿豆",
      "group_ids": [
        41,
        42,
        43,
        44,
        45,
        46,
        47
      ],
      "start_seconds": 28.92,
      "end_seconds": 31.775
    },
    {
      "id": "line-10",
      "phrase_id": 6,
      "text": "哈基米南北绿豆",
      "group_ids": [
        48,
        49,
        50,
        51,
        52,
        53,
        54
      ],
      "start_seconds": 31.775,
      "end_seconds": 34.79
    },
    {
      "id": "line-11",
      "phrase_id": 6,
      "text": "哈基米南北绿豆",
      "group_ids": [
        55,
        56,
        57,
        58,
        59,
        60,
        61
      ],
      "start_seconds": 34.79,
      "end_seconds": 38.505
    },
    {
      "id": "line-12",
      "phrase_id": 6,
      "text": "哈基米南北绿豆",
      "group_ids": [
        62,
        63,
        64,
        65,
        66,
        67,
        68
      ],
      "start_seconds": 38.505,
      "end_seconds": 41.41
    },
    {
      "id": "line-13",
      "phrase_id": 6,
      "text": "哈基米南北绿豆",
      "group_ids": [
        69,
        70,
        71,
        72,
        73,
        74,
        75
      ],
      "start_seconds": 41.41,
      "end_seconds": 44.405
    },
    {
      "id": "line-14",
      "phrase_id": 6,
      "text": "哈基米南北绿豆",
      "group_ids": [
        76,
        77,
        78,
        79,
        80,
        81,
        82
      ],
      "start_seconds": 44.405,
      "end_seconds": 48.55
    },
    {
      "id": "line-15",
      "phrase_id": 6,
      "text": "哈基米南北绿豆",
      "group_ids": [
        83,
        84,
        85,
        86,
        87,
        88,
        89
      ],
      "start_seconds": 48.55,
      "end_seconds": 52.275
    },
    {
      "id": "line-16",
      "phrase_id": 6,
      "text": "哈基米南北绿豆",
      "group_ids": [
        90,
        91,
        92,
        93,
        94,
        95,
        96
      ],
      "start_seconds": 52.275,
      "end_seconds": 54.27
    },
    {
      "id": "line-17",
      "phrase_id": 6,
      "text": "哈",
      "group_ids": [
        97
      ],
      "start_seconds": 54.27,
      "end_seconds": 54.7
    }
  ],
  "syllables": [
    {
      "id": "g001",
      "group_id": 1,
      "text": "哈",
      "phrase_id": 1,
      "line_id": "line-01",
      "start_seconds": 5.295,
      "end_seconds": 5.575,
      "raw_audio_end_seconds": 5.581,
      "stable_start_seconds": 5.32,
      "stable_end_seconds": 5.52,
      "note_event_ids": [
        1
      ],
      "qa_flags": []
    },
    {
      "id": "g002",
      "group_id": 2,
      "text": "基",
      "phrase_id": 1,
      "line_id": "line-01",
      "start_seconds": 5.575,
      "end_seconds": 5.76,
      "raw_audio_end_seconds": 5.766,
      "stable_start_seconds": 5.6,
      "stable_end_seconds": 5.69,
      "note_event_ids": [
        2
      ],
      "qa_flags": []
    },
    {
      "id": "g003",
      "group_id": 3,
      "text": "米",
      "phrase_id": 1,
      "line_id": "line-01",
      "start_seconds": 5.76,
      "end_seconds": 6.565,
      "raw_audio_end_seconds": 6.571,
      "stable_start_seconds": 5.81,
      "stable_end_seconds": 6.31,
      "note_event_ids": [
        3
      ],
      "qa_flags": []
    },
    {
      "id": "g004",
      "group_id": 4,
      "text": "南",
      "phrase_id": 1,
      "line_id": "line-01",
      "start_seconds": 6.565,
      "end_seconds": 6.745,
      "raw_audio_end_seconds": 6.751,
      "stable_start_seconds": 6.59,
      "stable_end_seconds": 6.74,
      "note_event_ids": [
        4
      ],
      "qa_flags": []
    },
    {
      "id": "g005",
      "group_id": 5,
      "text": "北",
      "phrase_id": 1,
      "line_id": "line-01",
      "start_seconds": 6.745,
      "end_seconds": 6.905,
      "raw_audio_end_seconds": 6.93,
      "stable_start_seconds": 6.77,
      "stable_end_seconds": 6.93,
      "note_event_ids": [
        5
      ],
      "qa_flags": []
    },
    {
      "id": "g006",
      "group_id": 6,
      "text": "绿",
      "phrase_id": 1,
      "line_id": "line-01",
      "start_seconds": 6.905,
      "end_seconds": 7.36,
      "raw_audio_end_seconds": 7.38,
      "stable_start_seconds": 6.93,
      "stable_end_seconds": 7.38,
      "note_event_ids": [
        6
      ],
      "qa_flags": []
    },
    {
      "id": "g007",
      "group_id": 7,